{
  "fixture": "valid/canonical/roman-case",
  "description": "Romanization case is preserved exactly as authored (REQ-CANON-006).",
  "requirements": ["REQ-CANON-006"],
  "input": "input.eld",
  "modes": ["inspect", "validate"],
  "outcome": "pass",
  "golden": [
    { "path": "golden/canonical.eld", "sha256": "91723d3c12cb754a3978d587a72b10b233462fadcbe4ce2ede26e60d3f0d56d9" }
  ]
}
