{
  "fixture": "valid/canonical/minimal-inventory",
  "description": "Smallest valid inventory: one `phonemes` root, one consonants group, one vowels group, one root each (REQ-CANON-001, REQ-CANON-002).",
  "requirements": ["REQ-CANON-001", "REQ-CANON-002"],
  "input": "input.eld",
  "modes": ["inspect", "validate"],
  "outcome": "pass",
  "golden": [
    { "path": "golden/canonical.eld", "sha256": "5294e63fcdbaa6a8c2ba329584ad66961beb3b0d2fa9b668a7e7e2027971e220" }
  ]
}
