{
  "fixture": "valid/canonical/unicode-preserved",
  "description": "Permitted Unicode (combining diacritic, spacing modifier) is emitted directly as UTF-8 and never silently normalized (REQ-CANON-008).",
  "requirements": ["REQ-CANON-008"],
  "input": "input.eld",
  "modes": ["inspect", "validate"],
  "outcome": "pass",
  "golden": [
    { "path": "golden/canonical.eld", "sha256": "5c94411fd7ed3b308d71ab1b634bc740087dccb058a0f248da709fe0bdb1a6d9" }
  ]
}
